{
  "schema_version": "field-content-3",
  "inventory_complete": true,
  "parameters": {
    "z1": {"domain": "integer"},
    "z2": {"domain": "integer"}
  },
  "constraints": ["0 < z1 < z2 < 3"],
  "gauge_factors": [
    {"id": "colour", "family": "A", "rank": 2},
    {"id": "weak", "family": "A", "rank": 1},
    {"id": "Y", "family": "U1", "rank": 1},
    {"id": "X", "family": "U1", "rank": 1}
  ],
  "matter": [
    {"lorentz":{"dimension":4,"scheme":"jL_jR","irreps":[["1/2","0"]]}, "reality":"none", "copies":3, "gauge_representations":{"colour":{"dynkin":[1,0]},"weak":{"dynkin":[1]},"Y":{"charge":"1"},"X":{"charge":"0"}}},
    {"lorentz":{"dimension":4,"scheme":"jL_jR","irreps":[["1/2","0"]]}, "reality":"none", "copies":3, "gauge_representations":{"colour":{"dynkin":[0,1]},"weak":{"dynkin":[0]},"Y":{"charge":"-4"},"X":{"charge":"0"}}},
    {"lorentz":{"dimension":4,"scheme":"jL_jR","irreps":[["1/2","0"]]}, "reality":"none", "copies":3, "gauge_representations":{"colour":{"dynkin":[0,1]},"weak":{"dynkin":[0]},"Y":{"charge":"2"},"X":{"charge":"0"}}},
    {"lorentz":{"dimension":4,"scheme":"jL_jR","irreps":[["1/2","0"]]}, "reality":"none", "copies":3, "gauge_representations":{"colour":{"dynkin":[0,0]},"weak":{"dynkin":[1]},"Y":{"charge":"-3"},"X":{"charge":"0"}}},
    {"lorentz":{"dimension":4,"scheme":"jL_jR","irreps":[["1/2","0"]]}, "reality":"none", "copies":3, "gauge_representations":{"colour":{"dynkin":[0,0]},"weak":{"dynkin":[0]},"Y":{"charge":"6"},"X":{"charge":"0"}}},
    {"lorentz":{"dimension":4,"scheme":"jL_jR","irreps":[["0","0"]]}, "reality":"complex", "copies":1, "gauge_representations":{"colour":{"dynkin":[0,0]},"weak":{"dynkin":[1]},"Y":{"charge":"3"},"X":{"charge":"0"}}},
    {"lorentz":{"dimension":4,"scheme":"jL_jR","irreps":[["1/2","0"]]}, "reality":"none", "copies":1, "gauge_representations":{"colour":{"dynkin":[0,0]},"weak":{"dynkin":[0]},"Y":{"charge":"0"},"X":{"charge":"z1**2 + z2"}}},
    {"lorentz":{"dimension":4,"scheme":"jL_jR","irreps":[["1/2","0"]]}, "reality":"none", "copies":1, "gauge_representations":{"colour":{"dynkin":[0,0]},"weak":{"dynkin":[0]},"Y":{"charge":"0"},"X":{"charge":"z2 - z1"}}}
  ]
}
