{
  "schema_version": "field-content-3",
  "inventory_complete": true,
  "name": "SM with three singlet neutrinos and family-universal U1 charges",
  "paper_ids": [
    "P15"
  ],
  "gauge_factors": [
    {
      "id": "colour",
      "family": "A",
      "rank": 2
    },
    {
      "id": "weak",
      "family": "A",
      "rank": 1
    },
    {
      "id": "hypercharge",
      "family": "U1",
      "rank": 1
    },
    {
      "id": "X",
      "family": "U1",
      "rank": 1
    }
  ],
  "parameters": {
    "q": {
      "domain": "integer"
    },
    "r": {
      "domain": "integer"
    }
  },
  "constraints": [
    "r != 0"
  ],
  "matter": [
    {
      "label": "Q",
      "lorentz": {
        "dimension": 4,
        "scheme": "jL_jR",
        "irreps": [
          [
            "1/2",
            "0"
          ]
        ]
      },
      "reality": "none",
      "copies": 3,
      "gauge_representations": {
        "colour": {
          "dynkin": [
            1,
            0
          ]
        },
        "weak": {
          "dynkin": [
            1
          ]
        },
        "hypercharge": {
          "charge": "1"
        },
        "X": {
          "charge": "q"
        }
      }
    },
    {
      "label": "u^c",
      "lorentz": {
        "dimension": 4,
        "scheme": "jL_jR",
        "irreps": [
          [
            "1/2",
            "0"
          ]
        ]
      },
      "reality": "none",
      "copies": 3,
      "gauge_representations": {
        "colour": {
          "dynkin": [
            0,
            1
          ]
        },
        "weak": {
          "dynkin": [
            0
          ]
        },
        "hypercharge": {
          "charge": "-4"
        },
        "X": {
          "charge": "-4*q-r"
        }
      }
    },
    {
      "label": "d^c",
      "lorentz": {
        "dimension": 4,
        "scheme": "jL_jR",
        "irreps": [
          [
            "1/2",
            "0"
          ]
        ]
      },
      "reality": "none",
      "copies": 3,
      "gauge_representations": {
        "colour": {
          "dynkin": [
            0,
            1
          ]
        },
        "weak": {
          "dynkin": [
            0
          ]
        },
        "hypercharge": {
          "charge": "2"
        },
        "X": {
          "charge": "2*q+r"
        }
      }
    },
    {
      "label": "L",
      "lorentz": {
        "dimension": 4,
        "scheme": "jL_jR",
        "irreps": [
          [
            "1/2",
            "0"
          ]
        ]
      },
      "reality": "none",
      "copies": 3,
      "gauge_representations": {
        "colour": {
          "dynkin": [
            0,
            0
          ]
        },
        "weak": {
          "dynkin": [
            1
          ]
        },
        "hypercharge": {
          "charge": "-3"
        },
        "X": {
          "charge": "-3*q"
        }
      }
    },
    {
      "label": "e^c",
      "lorentz": {
        "dimension": 4,
        "scheme": "jL_jR",
        "irreps": [
          [
            "1/2",
            "0"
          ]
        ]
      },
      "reality": "none",
      "copies": 3,
      "gauge_representations": {
        "colour": {
          "dynkin": [
            0,
            0
          ]
        },
        "weak": {
          "dynkin": [
            0
          ]
        },
        "hypercharge": {
          "charge": "6"
        },
        "X": {
          "charge": "6*q+r"
        }
      }
    },
    {
      "label": "H",
      "lorentz": {
        "dimension": 4,
        "scheme": "jL_jR",
        "irreps": [
          [
            "0",
            "0"
          ]
        ]
      },
      "reality": "complex",
      "copies": 1,
      "gauge_representations": {
        "colour": {
          "dynkin": [
            0,
            0
          ]
        },
        "weak": {
          "dynkin": [
            1
          ]
        },
        "hypercharge": {
          "charge": "-3"
        },
        "X": {
          "charge": "-3*q-r"
        }
      }
    },
    {
      "label": "N^c",
      "lorentz": {
        "dimension": 4,
        "scheme": "jL_jR",
        "irreps": [
          [
            "1/2",
            "0"
          ]
        ]
      },
      "reality": "none",
      "copies": 3,
      "gauge_representations": {
        "colour": {
          "dynkin": [
            0,
            0
          ]
        },
        "weak": {
          "dynkin": [
            0
          ]
        },
        "hypercharge": {
          "charge": "0"
        },
        "X": {
          "charge": "-r"
        }
      }
    }
  ]
}
